[
  {
    "name": "GitHub",
    "url": "https://github.com/chirag127",
    "icon": "github",
    "color": "#f0f6fc",
    "username": "chirag127",
    "category": "dev"
  },
  {
    "name": "Dev.to",
    "url": "https://dev.to/chirag127",
    "icon": "devto",
    "color": "#0a0a0a",
    "username": "chirag127",
    "category": "dev"
  },
  {
    "name": "LeetCode",
    "url": "https://leetcode.com/chirag127",
    "icon": "leetcode",
    "color": "#ffa116",
    "username": "chirag127",
    "category": "dev"
  },
  {
    "name": "Codewars",
    "url": "https://codewars.com/users/chirag127",
    "icon": "codewars",
    "color": "#b1361e",
    "username": "chirag127",
    "category": "dev"
  },
  {
    "name": "NPM",
    "url": "https://www.npmjs.com/~chirag127",
    "icon": "npm",
    "color": "#cb3837",
    "username": "chirag127",
    "category": "dev"
  },
  {
    "name": "HackerNews",
    "url": "https://news.ycombinator.com/user?id=chirag127",
    "icon": "hackernews",
    "color": "#ff6600",
    "username": "chirag127",
    "category": "dev"
  },
  {
    "name": "StackOverflow",
    "url": "https://stackoverflow.com/users/18901471/chirag127",
    "icon": "stackoverflow",
    "color": "#f48024",
    "username": "chirag127",
    "category": "dev"
  },
  {
    "name": "Holopin",
    "url": "https://holopin.io/@chirag127",
    "icon": "holopin",
    "color": "#2b6cb0",
    "username": "chirag127",
    "category": "dev"
  },
  {
    "name": "Bluesky",
    "url": "https://bsky.app/profile/chirag127.bsky.social",
    "icon": "bluesky",
    "color": "#0085ff",
    "username": "chirag127.bsky.social",
    "category": "social"
  },
  {
    "name": "Mastodon",
    "url": "https://mastodon.social/@chirag127",
    "icon": "mastodon",
    "color": "#6364ff",
    "username": "@chirag127",
    "category": "social"
  },
  {
    "name": "Reddit",
    "url": "https://reddit.com/user/chirag127",
    "icon": "reddit",
    "color": "#ff4500",
    "username": "u/chirag127",
    "category": "social"
  },
  {
    "name": "Pixelfed",
    "url": "https://pixelfed.social/chirag127",
    "icon": "pixelfed",
    "color": "#3b82f6",
    "username": "chirag127",
    "category": "social"
  },
  {
    "name": "Email",
    "url": "mailto:hi@chirag127.in",
    "icon": "mail",
    "color": "#6366f1",
    "username": "hi@chirag127.in",
    "category": "social"
  },
  {
    "name": "AniList",
    "url": "https://anilist.co/user/chirag127",
    "icon": "anilist",
    "color": "#02a9ff",
    "username": "chirag127",
    "category": "entertainment"
  },
  {
    "name": "Letterboxd",
    "url": "https://letterboxd.com/chirag127",
    "icon": "letterboxd",
    "color": "#00e054",
    "username": "chirag127",
    "category": "entertainment"
  },
  {
    "name": "Trakt",
    "url": "https://trakt.tv/users/chirag127",
    "icon": "trakt",
    "color": "#ed2224",
    "username": "chirag127",
    "category": "entertainment"
  },
  {
    "name": "Last.fm",
    "url": "https://last.fm/user/lastfmwhy",
    "icon": "lastfm",
    "color": "#d51007",
    "username": "lastfmwhy",
    "category": "music"
  },
  {
    "name": "ListenBrainz",
    "url": "https://listenbrainz.org/user/chirag127",
    "icon": "listenbrainz",
    "color": "#eb743b",
    "username": "chirag127",
    "category": "music"
  },
  {
    "name": "Mixcloud",
    "url": "https://www.mixcloud.com/chirag127",
    "icon": "mixcloud",
    "color": "#5000ff",
    "username": "chirag127",
    "category": "music"
  },
  {
    "name": "Lichess",
    "url": "https://lichess.org/@/chirag127",
    "icon": "lichess",
    "color": "#ffffff",
    "username": "chirag127",
    "category": "gaming"
  },
  {
    "name": "Speedrun",
    "url": "https://www.speedrun.com/user/chirag127",
    "icon": "speedrun",
    "color": "#f97316",
    "username": "chirag127",
    "category": "gaming"
  },
  {
    "name": "Open Library",
    "url": "https://openlibrary.org/people/wilarchive",
    "icon": "openlibrary",
    "color": "#e74c3c",
    "username": "wilarchive",
    "category": "reading"
  },
  {
    "name": "Hardcover",
    "url": "https://hardcover.app/users/chirag127",
    "icon": "hardcover",
    "color": "#a78bfa",
    "username": "chirag127",
    "category": "reading"
  },
  {
    "name": "Backloggd",
    "url": "https://backloggd.com/u/chirag127",
    "icon": "backloggd",
    "color": "#ef4444",
    "username": "chirag127",
    "category": "reading"
  }
]
